{
  "schema_version": "1.0.0",
  "event_id": "0192a1b2-c3d4-7e5f-8a9b-0c1d2e3f4a01",
  "ts": "2026-08-24T10:00:00Z",
  "source": "import.soul_import_v1",
  "kind": "import.item",
  "actor_subject": "self",
  "consent_id": "0192a1b2-c3d4-7e5f-8a9b-0c1d2e3f4a04",
  "privacy": {
    "subject": "self",
    "derivation": "raw",
    "purposes": ["soul_profile"],
    "retention": { "mode": "until_forgotten" },
    "egress": { "e0": "deny", "e1": "placeholder", "research_export": "deny" }
  },
  "body_ref": {
    "content_key_id": "0192a1b2-c3d4-7e5f-8a9b-0c1d2e3f4a02",
    "blob_id": "0192a1b2-c3d4-7e5f-8a9b-0c1d2e3f4a03",
    "alg": "xchacha20poly1305-ietf",
    "aad": "0192a1b2-c3d4-7e5f-8a9b-0c1d2e3f4a01|body_ref",
    "subject": "self",
    "char_count": 42,
    "placeholder": null
  }
}
