{
  "schema_version": "1.0.0",
  "event_id": "0192a1b2-c3d4-7e5f-8a9b-0c1d2e3f4a05",
  "ts": "2026-08-24T10:05:12.500Z",
  "source": "collector.foreground_app",
  "kind": "app.foreground",
  "actor_subject": "self",
  "consent_id": "0192a1b2-c3d4-7e5f-8a9b-0c1d2e3f4a04",
  "privacy": {
    "subject": "self",
    "derivation": "raw",
    "purposes": ["research", "soul_profile"],
    "retention": { "mode": "days", "days": 90 },
    "egress": { "e0": "deny", "e1": "deny", "research_export": "bucket" }
  },
  "body_ref": null
}
